{
  "app": "manubrium",
  "link": "manubrium://connect?secret=Xq3vN8pK2mW7tR4yB6cD9fH1jL5nP0sU-aE_gI2kM4o&server=https%3A%2F%2Fpairings.cloud",
  "server": "https://pairings.cloud",
  "code": "Xq3vN8pK2mW7tR4yB6cD9fH1jL5nP0sU-aE_gI2kM4o",
  "note": "The account page's Connect Manubrium. Query keys in any order."
}
